,created_at,date,tweet,Processed Tweet,Polarity
0,1649708561000.0,2022-04-11 13:22:41,@greeneconomyy hocam yeni çıkan ve alım bölgemin 0.11 olduğu @AstarNetwork projesi var. Bu coini seçme sebebim boğa yaşamaması ve projesinin Polkadot ekosisteminde yer alması ve inanılmaz bir hızla kendilerini geliştiriyor olmalarıdır Tvl de baya yüksek. Sizce bu coin uygunmudur,  hocam yeni   kan ve al m b lgemin 0 11 oldu u   projesi var  bu coini se me sebebim bo a ya amamas  ve projesinin polkadot ekosisteminde yer almas  ve inan lmaz bir h zla kendilerini geli tiriyor olmalar d r tvl de baya y ksek  sizce bu coin uygunmudur,0.0
1,1649708469000.0,2022-04-11 13:21:09,#DOT #Polkadot  https://t.co/Y6uS8Y0AJx, dot  polkadot   ,0.0
2,1649708344000.0,2022-04-11 13:19:04,$DOT Polkadot     https://t.co/0Lc3382rK6  https://t.co/Q0O3iOqLqX, dot polkadot         ,0.0
3,1649708285000.0,2022-04-11 13:18:05,"Sirius Finance, a stablecoin AMM and farming ceter on Polkadot and Astar network, is giving away 200,000 $SRS to the community!  https://t.co/VorJSJ7F2q",sirius finance  a stablecoin amm and farming ceter on polkadot and astar network  is giving away 200 000  srs to the community    ,0.0
4,1649708166000.0,2022-04-11 13:16:06,@lethalvst polkadot sapi yaa,  polkadot sapi yaa,0.0
5,1649708118000.0,2022-04-11 13:15:18,#Polkadot Price Prediction 2022 and Beyond – Can #DOT Reach $100?.   https://t.co/pD0Xma0Mbv, polkadot price prediction 2022 and beyond   can  dot reach  100      ,0.0
6,1649708111000.0,2022-04-11 13:15:11,together with @InvArchNetwork  your intellectual property is safe. #InvArch #Polkadot #Web3 #Parachain #XCM #blockchaintechnology,together with    your intellectual property is safe   invarch  polkadot  web3  parachain  xcm  blockchaintechnology,0.4
7,1649708089000.0,2022-04-11 13:14:49,Only days left to vote for talks and topics submitted for #PolkadotDecoded 2022 and help decide the final program of the biggest Polkadot event of the year.  Support your favorite speakers by voting now:   https://t.co/b00m3l0pai   $totem #polkadot #dotsama @totem_live_,only days left to vote for talks and topics submitted for  polkadotdecoded 2022 and help decide the final program of the biggest polkadot event of the year   support your favorite speakers by voting now         totem  polkadot  dotsama   live ,0.12727272727272726
8,1649708070000.0,2022-04-11 13:14:30,I just joined the DOTPad IDO whitelist Spot Giveaway! Complete the whitelist below for your chance to win a guaranteed spot for the first DOTPad IDO! #BSC #DOT $DOT $BTC $ETH $BNB #polkadot #kusama #moonbeam #substrate  https://t.co/NELa8TmKR4,i just joined the dotpad ido whitelist spot giveaway  complete the whitelist below for your chance to win a guaranteed spot for the first dotpad ido   bsc  dot  dot  btc  eth  bnb  polkadot  kusama  moonbeam  substrate   ,0.3833333333333333
9,1649708056000.0,2022-04-11 13:14:16,I think the @InvArchNetwork project has a great future. The project is actively developing and makes us happy with positive news. #InvArch #web3 #NFTs #Polkadot #DAOs #blockchain #Crypto,i think the   project has a great future  the project is actively developing and makes us happy with positive news   invarch  web3  nfts  polkadot  daos  blockchain  crypto,0.3387878787878788
10,1649707996000.0,2022-04-11 13:13:16,"Cryptocurrency Prices Today April 11: Bitcoin down, Polkadot biggest loser Bitcoin's price is currently Rs 33.41 lakh, with a dominance of 41.21 percent. This is a 0.26 percent increase over the day  https://t.co/gtQjUhD2Zq",cryptocurrency prices today april 11  bitcoin down  polkadot biggest loser bitcoin s price is currently rs 33 41 lakh  with a dominance of 41 21 percent  this is a 0 26 percent increase over the day   ,-0.07777777777777779
11,1649707968000.0,2022-04-11 13:12:48,@byoliviyou Polkadot si biar lucu,  polkadot si biar lucu,0.0
12,1649707944000.0,2022-04-11 13:12:24,@devanya__ kek polkadot yaa,    kek polkadot yaa,0.0
13,1649707931000.0,2022-04-11 13:12:11,"I just signed up to @Totem_Live_, the world's first true peer-to-peer accounting protocol on Polkadot.  Be an early adopter, signup now &amp; refer friends to receive your $TOTEM bonus:  https://t.co/FgH9iA8duF  #TotemLive #Airdrop #Polkadot #Kusama d70de026",i just signed up to   live   the world s first true peer to peer accounting protocol on polkadot   be an early adopter  signup now  amp  refer friends to receive your  totem bonus       totemlive  airdrop  polkadot  kusama d70de026,0.20909090909090908
14,1649707837000.0,2022-04-11 13:10:37,Polkadot Price Prediction 2022 and Beyond &amp;#8211; Can DOT Reach $100?   - Latest #Crypto News from #G2KC - Follow for News and Giveaways!  https://t.co/EcBxLdHWjU,polkadot price prediction 2022 and beyond  amp  8211  can dot reach  100      latest  crypto news from  g2kc   follow for news and giveaways    ,0.5
15,1649707804000.0,2022-04-11 13:10:04,Vote for us to learn more about our thesis and growth prospects for the Polkadot ecosystem!,vote for us to learn more about our thesis and growth prospects for the polkadot ecosystem ,0.5
16,1649707803000.0,2022-04-11 13:10:03,"@kevinsekniqi yeah, avalanche guys are funny  - they copy geth for c-chain, copy eip 1559. Then they copy comos and polkadot zones and parachains architecture - do some small changes and call them subnets. And they show off themselves like they are the clever ones.- LOL",  yeah  avalanche guys are funny    they copy geth for c chain  copy eip 1559  then they copy comos and polkadot zones and parachains architecture   do some small changes and call them subnets  and they show off themselves like they are the clever ones   lol,0.24166666666666667
17,1649707803000.0,2022-04-11 13:10:03,reddit /r/CryptoCurrency DD coin mentions (past hour)  #1🥇 Bitcoin: 20 (-1) #2🥈 Ethereum: 14 (+3) #3🥉 Polygon: 5 (+5) #4 Polkadot: 4 (+3) #5 ApeCoin: 3 (+2) #6 Cosmos: 3 (+0)  #BTC #ETH #MATIC #DOT #APE #ATOM,reddit  r cryptocurrency dd coin mentions  past hour    1  bitcoin  20   1   2  ethereum  14   3   3  polygon  5   5   4 polkadot  4   3   5 apecoin  3   2   6 cosmos  3   0    btc  eth  matic  dot  ape  atom,-0.25
18,1649707786000.0,2022-04-11 13:09:46,"yeah, avalanche guys are funny  - they copy geth for c-chain, copy eip 1559. Then they copy comos and polkadot zones and parachains architecture - do some small changes and call them subnets. And they show off themselves like they are the clever ones.- LOL  https://t.co/CI8sn1AngY",yeah  avalanche guys are funny    they copy geth for c chain  copy eip 1559  then they copy comos and polkadot zones and parachains architecture   do some small changes and call them subnets  and they show off themselves like they are the clever ones   lol   ,0.24166666666666667
19,1649707741000.0,2022-04-11 13:09:01,"@NoidedHolder yeah, avalanche guys are funny  - they copy geth for c-chain, copy eip 1559. Then they copy comos and polkadot zones and parachains architecture - do some small changes and call them subnets. And they show off themselves like they are the clever ones.- LOL",  yeah  avalanche guys are funny    they copy geth for c chain  copy eip 1559  then they copy comos and polkadot zones and parachains architecture   do some small changes and call them subnets  and they show off themselves like they are the clever ones   lol,0.24166666666666667
20,1649707716000.0,2022-04-11 13:08:36,"Sirius Finance, a stablecoin AMM and farming ceter on Polkadot and Astar network, is giving away 200,000 $SRS to the community!  https://t.co/TBLs81vva7",sirius finance  a stablecoin amm and farming ceter on polkadot and astar network  is giving away 200 000  srs to the community    ,0.0
21,1649707647000.0,2022-04-11 13:07:27,@abruzuc Estoy buscando algun hilo similar a este pero en Polkadot con substrate. Alguien tiene data?,  estoy buscando algun hilo similar a este pero en polkadot con substrate  alguien tiene data ,0.0
22,1649707639000.0,2022-04-11 13:07:19,Polkadot Price Prediction 2022 and Beyond - Can DOT Reach $100?   https://t.co/QDUcerO6pz,polkadot price prediction 2022 and beyond   can dot reach  100     ,0.0
23,1649707614000.0,2022-04-11 13:06:54,Stop adding me to your fake Polkadot accounts. All that do so will be removed from Twitter.,stop adding me to your fake polkadot accounts  all that do so will be removed from twitter ,-0.5
24,1649707560000.0,2022-04-11 13:06:00,"@NoidedHolder yeah, avalanche guys are funny  - they copy geth for c-chain, copy eip 1559. Then they copy comos and polkadot zones and parachains architecture - do some small changes and call them subnets. And they show off themselves like they are the clever ones.- LOL",  yeah  avalanche guys are funny    they copy geth for c chain  copy eip 1559  then they copy comos and polkadot zones and parachains architecture   do some small changes and call them subnets  and they show off themselves like they are the clever ones   lol,0.24166666666666667
25,1649707499000.0,2022-04-11 13:04:59,"Sirius Finance, a stablecoin AMM and farming ceter on Polkadot and Astar network, is giving away 200,000 $SRS to the community!  https://t.co/EZhdj6ukzv",sirius finance  a stablecoin amm and farming ceter on polkadot and astar network  is giving away 200 000  srs to the community    ,0.0
26,1649707448000.0,2022-04-11 13:04:08,"Sirius Finance, a stablecoin AMM and farming ceter on Polkadot and Astar network, is giving away 200,000 $SRS to the community!  https://t.co/GRhjNPOCUD",sirius finance  a stablecoin amm and farming ceter on polkadot and astar network  is giving away 200 000  srs to the community    ,0.0
27,1649707444000.0,2022-04-11 13:04:04,"@tessa_dawn1 @BTE_web3name @BTE_BOTLabs @Kiltprotocol @Polkadot Great, simple to use guide. Thanks @tessa_dawn1",  dawn1   web3name   botlabs     great  simple to use guide  thanks   dawn1,0.3333333333333333
28,1649707367000.0,2022-04-11 13:02:47,Things are starting to get interesting.  Will @PhantasmaChain $SOUL be interoperable with #Polkadot $DOT in the future?   @Polkadot $DOT @polkastarter $POLS,things are starting to get interesting   will    soul be interoperable with  polkadot  dot in the future       dot    pols,0.16666666666666666
29,1649707359000.0,2022-04-11 13:02:39,"$ADA $DOT $SOL NEW ARTICLE : Why Polkadot, Cardano, and Solana All Dropped Today  https://t.co/628hxgWvFo Get all the latest $ADA.X related news here :  https://t.co/zW23C8s76E", ada  dot  sol new article   why polkadot  cardano  and solana all dropped today    get all the latest  ada x related news here     ,0.21212121212121213
30,1649707358000.0,2022-04-11 13:02:38,@techryper @Kiltprotocol @Polkadot Çok teşekkür ederim hocm cevap için,       ok te ekk r ederim hocm cevap i in,0.5
31,1649707299000.0,2022-04-11 13:01:39,💰 CRYPTO BUYS (04/11/2022 16:01) - Polkadot: $17.651 - Kusama: $156.594 - Curve DAO Token: $2.187 #Polkadot #Kusama #CurveDAOToken  #crypto #cryptotrading #coinbase #cryptocurrency #cryptomarket #bitcoin #ethereum #trading #investing,  crypto buys  04 11 2022 16 01    polkadot   17 651   kusama   156 594   curve dao token   2 187  polkadot  kusama  curvedaotoken   crypto  cryptotrading  coinbase  cryptocurrency  cryptomarket  bitcoin  ethereum  trading  investing,0.0
32,1649707282000.0,2022-04-11 13:01:22,Top 10 coins by Coinrank as of April 11th:  $ETH #Ethereum $SOL #Solana $DOT #Polkadot $ADA #Cardano $MANA #Decentraland $AVAX #Avalanche $NEAR #NEARProtocol $MATIC #Polygon $EGLD #Elrond $ICP #InternetComputer   https://t.co/FijRjIb0Po,top 10 coins by coinrank as of april 11th    eth  ethereum  sol  solana  dot  polkadot  ada  cardano  mana  decentraland  avax  avalanche  near  nearprotocol  matic  polygon  egld  elrond  icp  internetcomputer    ,0.3
33,1649707281000.0,2022-04-11 13:01:21,"Abren las votaciones para las charlas en el Polkadot Decoded 2022, y anuncian que México será sede  https://t.co/n2AkIwT3HM",abren las votaciones para las charlas en el polkadot decoded 2022  y anuncian que m xico ser  sede   ,0.0
34,1649707255000.0,2022-04-11 13:00:55,"I just signed up to @Totem_Live_, the world's first true peer-to-peer accounting protocol on Polkadot.  Be an early adopter, signup now &amp; refer friends to receive your $TOTEM bonus:  https://t.co/pmnC4RUkNz  #TotemLive #Airdrop #Polkadot #Kusama 22e598d6",i just signed up to   live   the world s first true peer to peer accounting protocol on polkadot   be an early adopter  signup now  amp  refer friends to receive your  totem bonus       totemlive  airdrop  polkadot  kusama 22e598d6,0.20909090909090908
35,1649707245000.0,2022-04-11 13:00:45,"yeah, avalanche guys are funny  - they copy geth for c-chain, copy eip 1559. Then they copy comos and polkadot zones and parachains architecture - do some small changes and call them subnets. And they show off themselves like they are the clever ones.- LOL",yeah  avalanche guys are funny    they copy geth for c chain  copy eip 1559  then they copy comos and polkadot zones and parachains architecture   do some small changes and call them subnets  and they show off themselves like they are the clever ones   lol,0.24166666666666667
36,1649707205000.0,2022-04-11 13:00:05,"Abren las votaciones para las charlas en el Polkadot Decoded 2022, y anuncian que México será sede  https://t.co/wd6dSRfZAO  https://t.co/p8ea3XkwZE",abren las votaciones para las charlas en el polkadot decoded 2022  y anuncian que m xico ser  sede      ,0.0
37,1649707112000.0,2022-04-11 12:58:32,"yeah, avalanche guys are funny  - they copy geth for c-chain, copy eip 1559. Then they copy comos and polkadot zones and parachains architecture - do some small changes and call them subnets. And they show off themselves like they are the clever ones.- LOL",yeah  avalanche guys are funny    they copy geth for c chain  copy eip 1559  then they copy comos and polkadot zones and parachains architecture   do some small changes and call them subnets  and they show off themselves like they are the clever ones   lol,0.24166666666666667
38,1649707052000.0,2022-04-11 12:57:32,@CryptoJustina Polkadot ecosystem $efi $glmr $astr will make the one who choose it very happy,  polkadot ecosystem  efi  glmr  astr will make the one who choose it very happy,1.0
39,1649707017000.0,2022-04-11 12:56:57,"@seivalorant Frederic, Polkadot Stingray, Sakanaction, Dadaray, Genie High and Gesu no Kiwami Otome are my go to whenever I listen to Jrock these days",  frederic  polkadot stingray  sakanaction  dadaray  genie high and gesu no kiwami otome are my go to whenever i listen to jrock these days,0.16
40,1649706994000.0,2022-04-11 12:56:34,"@kevinsekniqi yeah, avalanche guys are funny  - they copy geth for c-chain, copy eip 1559. Then they copy comos and polkadot zones and parachains architecture - do some small changes and call them subnets. And they show off themselves like they are the clever ones.- LOL",  yeah  avalanche guys are funny    they copy geth for c chain  copy eip 1559  then they copy comos and polkadot zones and parachains architecture   do some small changes and call them subnets  and they show off themselves like they are the clever ones   lol,0.24166666666666667
41,1649706987000.0,2022-04-11 12:56:27,"@revolut20 @kingdomswapgame I see that Kingdom-Swap is a Binance Smart Chain native MMORPG P2E NFT GAME. what tools or benefits did you see in this ecosystem that surpasses other powerful ecosystems such as ETH, POLKADOT, SOLANA? And is it in your plans to expand to other chains, if so what would they be?",    i see that kingdom swap is a binance smart chain native mmorpg p2e nft game  what tools or benefits did you see in this ecosystem that surpasses other powerful ecosystems such as eth  polkadot  solana  and is it in your plans to expand to other chains  if so what would they be ,-0.022619047619047622
42,1649706912000.0,2022-04-11 12:55:12,"Sirius Finance, a stablecoin AMM and farming ceter on Polkadot and Astar network, is giving away 200,000 $SRS to the community!  https://t.co/D6Ka7U1Pbq",sirius finance  a stablecoin amm and farming ceter on polkadot and astar network  is giving away 200 000  srs to the community    ,0.0
43,1649706646000.0,2022-04-11 12:50:46,Only days left to vote for talks and topics submitted for #PolkadotDecoded 2022 and help decide the final program of the biggest Polkadot event of the year.  Support your favorite speakers by voting now:   https://t.co/gRy0NXMDdj   $totem #polkadot #dotsama @totem_live_,only days left to vote for talks and topics submitted for  polkadotdecoded 2022 and help decide the final program of the biggest polkadot event of the year   support your favorite speakers by voting now         totem  polkadot  dotsama   live ,0.12727272727272726
44,1649706632000.0,2022-04-11 12:50:32,"...they're the first zero-knowledge proof in Kusama and Polkadot (when fully launched). We get to know why #PrivacyMatters.   To vote for this particular talk, press the link below ⬇️⬇️  3/   https://t.co/YxQcnlcqKA",   they re the first zero knowledge proof in kusama and polkadot  when fully launched   we get to know why  privacymatters    to vote for this particular talk  press the link below       3     ,0.20833333333333331
45,1649706632000.0,2022-04-11 12:50:32,"There are great talks under the theme ""Polkadot In Action"" but I'm mostly interested in Shumo Chu's (@shumochu) talk titled ""Manta: Building Privacy Layer for Web3 using substrate"". Get to know why #MantaNetwork was built on Substrate and how this...  2/",there are great talks under the theme  polkadot in action  but i m mostly interested in shumo chu s     talk titled  manta  building privacy layer for web3 using substrate   get to know why  mantanetwork was built on substrate and how this     2 ,0.3833333333333333
46,1649706553000.0,2022-04-11 12:49:13,Only days left to vote for talks and topics submitted for #PolkadotDecoded 2022 and help decide the final program of the biggest Polkadot event of the year.  Support your favorite speakers by voting now:   https://t.co/rsXdIL2VkK   $totem #polkadot #dotsama @totem_live_,only days left to vote for talks and topics submitted for  polkadotdecoded 2022 and help decide the final program of the biggest polkadot event of the year   support your favorite speakers by voting now         totem  polkadot  dotsama   live ,0.12727272727272726
47,1649706522000.0,2022-04-11 12:48:42,"⁠Abren las votaciones para las charlas en elPolkadot Decoded 2022, y anuncian que México será sede  La organización del Polkadot Decoded 2022 abre las votaciones para las charlas, y anuncia a México como una de las sedes.   https://t.co/FSWb7IvS4z", abren las votaciones para las charlas en elpolkadot decoded 2022  y anuncian que m xico ser  sede  la organizaci n del polkadot decoded 2022 abre las votaciones para las charlas  y anuncia a m xico como una de las sedes     ,0.0
48,1649706449000.0,2022-04-11 12:47:29,"La organización del Polkadot Decoded 2022 abre las votaciones para las charlas, y anuncia a México como una de las sedes.   https://t.co/HEy5Wj6H5o",la organizaci n del polkadot decoded 2022 abre las votaciones para las charlas  y anuncia a m xico como una de las sedes     ,0.0
49,1649706411000.0,2022-04-11 12:46:51,Why I Am Bullish on Polkadot for 2022  https://t.co/9qJkMBWP5E,why i am bullish on polkadot for 2022   ,0.0
50,1649706305000.0,2022-04-11 12:45:05,"I just signed up to @Totem_Live_, the world's first true peer-to-peer accounting protocol on Polkadot.  Be an early adopter, signup now &amp; refer friends to receive your $TOTEM bonus:  https://t.co/tIRsZxEvFx  #TotemLive #Airdrop #Polkadot #Kusama 11ae6d7a",i just signed up to   live   the world s first true peer to peer accounting protocol on polkadot   be an early adopter  signup now  amp  refer friends to receive your  totem bonus       totemlive  airdrop  polkadot  kusama 11ae6d7a,0.20909090909090908
51,1649706261000.0,2022-04-11 12:44:21,@AloshyAkasoto @KoyaPotentdream @MoonbeamNetwork @Polkadot Ser you’re forgetting $ASTAR   https://t.co/ZbQyxJI7rW,        ser you re forgetting  astar    ,0.0
52,1649706250000.0,2022-04-11 12:44:10,Sabias que con @ZenlinkPro puedes construir con un solo clic? 🚀Así es #Zenlink es un DEX compatible con el ecosistema de Polkadot.  https://t.co/o1IZxEiNnb,sabias que con   puedes construir con un solo clic   as  es  zenlink es un dex compatible con el ecosistema de polkadot    ,0.0
53,1649706240000.0,2022-04-11 12:44:00,Only days left to vote for talks and topics submitted for #PolkadotDecoded 2022 and help decide the final program of the biggest Polkadot event of the year.  Support your favorite speakers by voting now:   https://t.co/rDLQjgw1t7   $totem #polkadot #dotsama @totem_live_,only days left to vote for talks and topics submitted for  polkadotdecoded 2022 and help decide the final program of the biggest polkadot event of the year   support your favorite speakers by voting now         totem  polkadot  dotsama   live ,0.12727272727272726
54,1649706230000.0,2022-04-11 12:43:50,Firefly @fireflyprotocol использует общую безопасность в цепи ретрансляции Polkadot.  #FireflyAmbassador,firefly                                                     polkadot    fireflyambassador,0.0
55,1649706189000.0,2022-04-11 12:43:09,@CHRISCRYPT0 @SBHodler @BitDotCountry @Polkadot_Bcn Thank u for answer 🙏,        bcn thank u for answer  ,0.0
56,1649706183000.0,2022-04-11 12:43:03,"@TokenAsset @TheDotSamaEXPC @rmrk @Polkadot @kusamanetwork Yes, it will be Dutch auction (Price will start at max and will drop constantly)",          yes  it will be dutch auction  price will start at max and will drop constantly ,0.0
57,1649706179000.0,2022-04-11 12:42:59,Only days left to vote for talks and topics submitted for #PolkadotDecoded 2022 and help decide the final program of the biggest Polkadot event of the year.  Support your favorite speakers by voting now:   https://t.co/SouFm2Hotu   $totem #polkadot #dotsama @totem_live_,only days left to vote for talks and topics submitted for  polkadotdecoded 2022 and help decide the final program of the biggest polkadot event of the year   support your favorite speakers by voting now         totem  polkadot  dotsama   live ,0.12727272727272726
58,1649706117000.0,2022-04-11 12:41:57,@berzanberz @Kiltprotocol @Polkadot Azero önplanda ama Kilt in arzı da çok az nitelikli ayirt etmek zor oluyor,      azero  nplanda ama kilt in arz  da  ok az nitelikli ayirt etmek zor oluyor,0.5
59,1649706093000.0,2022-04-11 12:41:33,"@kllnn44 @SBHodler @BitDotCountry @Polkadot_Bcn I can't say the exact date for the listing, but what I can tell is the following: 1.- 2nd Audit and release of public testnet. (May) 2.- Launch on Mainnet.  3.- $NEER listing.  The release of the 2nd and 3rd will depend on the results from the previous one respectively.",        bcn i can t say the exact date for the listing  but what i can tell is the following  1   2nd audit and release of public testnet   may  2   launch on mainnet   3    neer listing   the release of the 2nd and 3rd will depend on the results from the previous one respectively ,0.010416666666666668
60,1649706039000.0,2022-04-11 12:40:39,@arthswap @Polkadot 👀 16th April,      16th april,0.0
61,1649706029000.0,2022-04-11 12:40:29,@BTE_BOTLabs @Polkadot @ingoruebe @goldquest @BTE_web3name How long will it be free? I'm not going to be home until Saturday 😅,  botlabs         web3name how long will it be free  i m not going to be home until saturday  ,0.17500000000000002
62,1649706018000.0,2022-04-11 12:40:18,"Why Polkadot, Cardano, and Solana All Dropped Today #crypto #cryptocurrency #cardano #ada #cryptonews  https://t.co/4WyvlM7FT3",why polkadot  cardano  and solana all dropped today  crypto  cryptocurrency  cardano  ada  cryptonews   ,0.0
63,1649706003000.0,2022-04-11 12:40:03,@techryper @Kiltprotocol @Polkadot Hocam size göre yeni sol #Kilt  mi yoksa #AZERO  mu?,      hocam size g re yeni sol  kilt  mi yoksa  azero  mu ,0.0
64,1649705931000.0,2022-04-11 12:38:51,Great project 🔥 . Thanks for this valuable opportunity❤ . @Nimeshwicky809  @Jeewa_Basnayaka  @Sithumakash5  #AstridDAO #Astar #Polkadot,great project     thanks for this valuable opportunity         basnayaka      astriddao  astar  polkadot,0.5
65,1649705923000.0,2022-04-11 12:38:43,"@Polkadot @PBWSummit Looks like a great event, but you should check out #BlockDownFestival @BlockDownConf in Croatia as well! This festival is the ultimate post-lockdown extravaganza for the Web3 community. You will be amazed!  https://t.co/ZSIefreCT8",    looks like a great event  but you should check out  blockdownfestival   in croatia as well  this festival is the ultimate post lockdown extravaganza for the web3 community  you will be amazed    ,0.4
66,1649705881000.0,2022-04-11 12:38:01,"On April 13 at 7pm CET, take your chance to join a special Polkadot party during @PBWSummit. Register now to enjoy an evening with dinner, drinks, and a special set from a world-famous DJ.  For #PBWS2022 attendees, don't forget to grab your PBWS pass along. https://t.co/7zm5lXqDRI",on april 13 at 7pm cet  take your chance to join a special polkadot party during    register now to enjoy an evening with dinner  drinks  and a special set from a world famous dj   for  pbws2022 attendees  don t forget to grab your pbws pass along   ,0.4035714285714286
67,1649705780000.0,2022-04-11 12:36:20,Seems kind of sus.  #DOT #POLKADOT  https://t.co/t6kMG0dd7L,seems kind of sus    dot  polkadot   ,0.6
