,created_at,date,tweet,Processed Tweet
0,1647832174000.0,2022-03-20 20:09:34,MEU DEUS O ELI NAO ACERTA NEM A ROLETA MEU DEUS DO CÉU,meu deus o eli nao acerta nem a roleta meu deus do c u
1,1647832173000.0,2022-03-20 20:09:33,Nem acredito que eu vou pro lollaaaaaa,nem acredito que eu vou pro lollaaaaaa
2,1647832173000.0,2022-03-20 20:09:33,"eu fico pensando, será que essa menina fica o tempo todo no meu insta atualizando a página pra ver meus trem? pq não tem lógica, nem me segue e vê todos os stories enfim, a fã",eu fico pensando  ser  que essa menina fica o tempo todo no meu insta atualizando a p gina pra ver meus trem  pq n o tem l gica  nem me segue e v  todos os stories enfim  a f 
3,1647832173000.0,2022-03-20 20:09:33,"@Jubszzs Simmm jubs, ele é pitico q nem você  🤏🤏",  simmm jubs  ele   pitico q nem voc     
4,1647832173000.0,2022-03-20 20:09:33,NEM QUANDO O MALUCO COLOCA MENOS FORÇA KKKKKKKKKKKK,nem quando o maluco coloca menos for a kkkkkkkkkkkk
5,1647832173000.0,2022-03-20 20:09:33,@g1daANlTTA Nunca fizeram isso com nem um lançamento da karol kkkkk,  nunca fizeram isso com nem um lan amento da karol kkkkk
6,1647832173000.0,2022-03-20 20:09:33,Na vida eu sou azarada que nem o eli 🫣,na vida eu sou azarada que nem o eli  
7,1647832173000.0,2022-03-20 20:09:33,nem tô mais com vontade de acompanhar mas nesse paredão sou fica laís,nem t  mais com vontade de acompanhar mas nesse pared o sou fica la s
8,1647832173000.0,2022-03-20 20:09:33,"@MadugomesCRF verdade,mas,ele n acerta nem um número kkkkkkkk",  verdade mas ele n acerta nem um n mero kkkkkkkk
9,1647832173000.0,2022-03-20 20:09:33,Nem quando torço pra um lollipop eles conseguem ganhar alguma prova pqp Eli!,nem quando tor o pra um lollipop eles conseguem ganhar alguma prova pqp eli 
10,1647832172000.0,2022-03-20 20:09:32,amn eu nn vou querer nem levantar,amn eu nn vou querer nem levantar
11,1647832172000.0,2022-03-20 20:09:32,NEM FUDENDOOOO HAHAHAHAHAHAHAHAHAHAHAHAHAHAHAHAHAHAHHHAHAHAHAHAHAHAHAHAHAHAHA,nem fudendoooo hahahahahahahahahahahahahahahahahahahhhahahahahahahahahahahaha
12,1647832172000.0,2022-03-20 20:09:32,nem descansei e já é segunda,nem descansei e j    segunda
13,1647832172000.0,2022-03-20 20:09:32,"o eli desesperando e tentando aliviar fazendo piada, nem gosto dele e to com dó",o eli desesperando e tentando aliviar fazendo piada  nem gosto dele e to com d 
14,1647832172000.0,2022-03-20 20:09:32,O lolipop nem na roleta consegue ganhar kkkkkk,o lolipop nem na roleta consegue ganhar kkkkkk
15,1647832172000.0,2022-03-20 20:09:32,Nem ferrando kkkkkkk tenta mais não coitado mkmmm,nem ferrando kkkkkkk tenta mais n o coitado mkmmm
16,1647832170000.0,2022-03-20 20:09:30,A prova nem acabou mas já pode começar a votar na Laís? Kkk,a prova nem acabou mas j  pode come ar a votar na la s  kkk
17,1647832170000.0,2022-03-20 20:09:30,Se o boninho não tivesse manipulado o resultado da casa d vidro esse Gustavo lixo não ia tá nem ali #bbb22,se o boninho n o tivesse manipulado o resultado da casa d vidro esse gustavo lixo n o ia t  nem ali  bbb22
18,1647832170000.0,2022-03-20 20:09:30,Vai até de manhã isso aí e no final nem vai fazer diferença,vai at  de manh  isso a  e no final nem vai fazer diferen a
19,1647832170000.0,2022-03-20 20:09:30,o dg tentando todas sendo que nem tem premio,o dg tentando todas sendo que nem tem premio
20,1647832170000.0,2022-03-20 20:09:30,"eu amo quando minha mãe trás pizza do trabalho dela, não faço nem esforço em tentar não comer kkkkkk",eu amo quando minha m e tr s pizza do trabalho dela  n o fa o nem esfor o em tentar n o comer kkkkkk
21,1647832170000.0,2022-03-20 20:09:30,queria que alguém insistisse em mim que nem o dg insiste no 18,queria que algu m insistisse em mim que nem o dg insiste no 18
22,1647832170000.0,2022-03-20 20:09:30,dg nem se concentra,dg nem se concentra
23,1647832170000.0,2022-03-20 20:09:30,@KaioNocetti Nem falo nada rs,  nem falo nada rs
24,1647832169000.0,2022-03-20 20:09:29,@caroltuittaa Só mostra que é doente por alguém que não tá nem aí pra ela!,  s  mostra que   doente por algu m que n o t  nem a  pra ela 
25,1647832169000.0,2022-03-20 20:09:29,"@balaoyas13 Minha mãe com 4 anos me colocou na creche, e no primeiro dia eu consegui me esconder atrás do escorrego, e fugi. Fui correndo p casa e quando cheguei minha mãe tava no meio do caminho indo p algum lugar! Eu gritei ela e eu ACHO q ela surtou lá na creche pq nem viram eu fugir kkk",  minha m e com 4 anos me colocou na creche  e no primeiro dia eu consegui me esconder atr s do escorrego  e fugi  fui correndo p casa e quando cheguei minha m e tava no meio do caminho indo p algum lugar  eu gritei ela e eu acho q ela surtou l  na creche pq nem viram eu fugir kkk
26,1647832169000.0,2022-03-20 20:09:29,KKKKKKKKKKKKKKKKKK NEM O TADEU TA AGUENTANDO  se eli tá se fodendo eu tô feliz,kkkkkkkkkkkkkkkkkk nem o tadeu ta aguentando  se eli t  se fodendo eu t  feliz
27,1647832169000.0,2022-03-20 20:09:29,Minha hora tá que nem a do Eli em questão de sorte. Coitado...  #BBB222 #bbb,minha hora t  que nem a do eli em quest o de sorte  coitado      bbb222  bbb
28,1647832169000.0,2022-03-20 20:09:29,"@pietr0reis_ @uepaakkhmjjj eu tb sou, nem por isso falo a língua de lá",     eu tb sou  nem por isso falo a l ngua de l 
29,1647832169000.0,2022-03-20 20:09:29,nem deus ta do lado do eliezer #bbb22,nem deus ta do lado do eliezer  bbb22
30,1647832169000.0,2022-03-20 20:09:29,"@CarlosBolsonaro @brom_elisa Vou dizer uma coisa. Terceira Via já não existe. No final das contas, o Capitão e o Ladrão. O Nine não aguenta nem o primeiro round. Como você imagina um debate presidencial entre ambos??? #bolsonaroeleitonoprimeiroturno",    elisa vou dizer uma coisa  terceira via j  n o existe  no final das contas  o capit o e o ladr o  o nine n o aguenta nem o primeiro round  como voc  imagina um debate presidencial entre ambos     bolsonaroeleitonoprimeiroturno
31,1647832169000.0,2022-03-20 20:09:29,@folha Que fique bem claro a Rússia de que jair bolsonaro não representa os cidadãos de bem do Brasil.  O que diz ou deixa de dizer não tem nem um pingo de valor.  #ForaBolsonaroESeuBandoDeCriminosos  #ForaBolsonaroESuasCadelas,  que fique bem claro a r ssia de que jair bolsonaro n o representa os cidad os de bem do brasil   o que diz ou deixa de dizer n o tem nem um pingo de valor    forabolsonaroeseubandodecriminosos   forabolsonaroesuascadelas
32,1647832169000.0,2022-03-20 20:09:29,"@Lokotuita @instacinefilos Rapaz, nem dublê é igual ao Jack Chan. Os caras têm amor a vida.",    rapaz  nem dubl    igual ao jack chan  os caras t m amor a vida 
33,1647832169000.0,2022-03-20 20:09:29,"@_soujhs @0800Cleb @Astronomiaum Mano não tenho mais o q falar contigo, vc aparenta nem reconhece o quão grande é o nosso país e creio q esse assunto do PIB já foi encerrado.. vlw ai e Boa Noite!",  soujhs     mano n o tenho mais o q falar contigo  vc aparenta nem reconhece o qu o grande   o nosso pa s e creio q esse assunto do pib j  foi encerrado   vlw ai e boa noite 
34,1647832169000.0,2022-03-20 20:09:29,NEM FERRANDO KKKKKKKKKKK #BBB22,nem ferrando kkkkkkkkkkk  bbb22
35,1647832169000.0,2022-03-20 20:09:29,"entra uma no cu da outra ó ó, tô nem aí",entra uma no cu da outra      t  nem a 
36,1647832169000.0,2022-03-20 20:09:29,"Falei pra minha mãe ontem que eu sei que vou morrer ""não vai ser semana que vem nem na outra nem mês que vem mais um dia vou ceder e acabar botando um fim em tudo"" e ela só disse eu sei que você tem sido forte mas infelizmente também sei que vai ser algo que vai acontecer",falei pra minha m e ontem que eu sei que vou morrer  n o vai ser semana que vem nem na outra nem m s que vem mais um dia vou ceder e acabar botando um fim em tudo  e ela s  disse eu sei que voc  tem sido forte mas infelizmente tamb m sei que vai ser algo que vai acontecer
37,1647832168000.0,2022-03-20 20:09:28,Se nem deus quer salvar o Eli imagina eu? #ForaEli #bbb22,se nem deus quer salvar o eli imagina eu   foraeli  bbb22
38,1647832168000.0,2022-03-20 20:09:28,eh galera gramgene endgame mesmo kk...........mas tudo bem nem sempre podemos ter tudo !,eh galera gramgene endgame mesmo kk           mas tudo bem nem sempre podemos ter tudo  
39,1647832168000.0,2022-03-20 20:09:28,"@elysianoctus eu ia esperar mas n quero nem ayato nem ayaka, ent vai dar pra juntar dnv e eu preciso de dps mas por enquanto ta de boa, fui tentar a sorte na raiden só",  eu ia esperar mas n quero nem ayato nem ayaka  ent vai dar pra juntar dnv e eu preciso de dps mas por enquanto ta de boa  fui tentar a sorte na raiden s 
40,1647832168000.0,2022-03-20 20:09:28,@Silva_DG Nem percebi 😂,  dg nem percebi  
41,1647832168000.0,2022-03-20 20:09:28,Nem fudendo i kkkkkkk pqp #BBB22,nem fudendo i kkkkkkk pqp  bbb22
42,1647832168000.0,2022-03-20 20:09:28,@delapollon Mas no teu caso não tem nem defesa,  mas no teu caso n o tem nem defesa
43,1647832168000.0,2022-03-20 20:09:28,@ItsWilsRibeiro Juro kkkkkkkkk nem ele aguenta,  juro kkkkkkkkk nem ele aguenta
44,1647832168000.0,2022-03-20 20:09:28,"@maricotaamaro Capaz pô, super de boa. No momento nem tô usando nos jogos que jogo. Tu que sabe, se precisar eh nois",  capaz p   super de boa  no momento nem t  usando nos jogos que jogo  tu que sabe  se precisar eh nois
45,1647832167000.0,2022-03-20 20:09:27,"Porque são arrogantes e têm o rei na barriga. Acham que podem fazer o que querem. São todos insuportáveis. Não aguento nem ouvir a voz dos 4, DG, PA, Artur é Scooby, que aliás falam como se tivessem um ovo na boca.",porque s o arrogantes e t m o rei na barriga  acham que podem fazer o que querem  s o todos insuport veis  n o aguento nem ouvir a voz dos 4  dg  pa  artur   scooby  que ali s falam como se tivessem um ovo na boca 
46,1647832167000.0,2022-03-20 20:09:27,"""nem assim"" kkkkkkkkkkkkkk #BBB22", nem assim  kkkkkkkkkkkkkk  bbb22
47,1647832167000.0,2022-03-20 20:09:27,"começar a encher o saco eu faço que nem meu homi, começo a criar inferninho 😋",come ar a encher o saco eu fa o que nem meu homi  come o a criar inferninho  
48,1647832167000.0,2022-03-20 20:09:27,To torcendo pelo heterotop nem to ai #bbb22,to torcendo pelo heterotop nem to ai  bbb22
49,1647832167000.0,2022-03-20 20:09:27,"Nem o tadeu aguenta a risada, do Eli só tirando zero #BBB22",nem o tadeu aguenta a risada  do eli s  tirando zero  bbb22
50,1647832167000.0,2022-03-20 20:09:27,"@ComentaOReality Não ligo, por isso não fico julgando Ninguém, só falo quando vejo algo extremamente explicito, mas alguém como você que não perdoa uma fala problemática é MUITO estranho esse amor pela Laís. Mas enfim isso é algo pessoal seu, eu nem temho nada a ver, só acho estranho mesmo.",  n o ligo  por isso n o fico julgando ningu m  s  falo quando vejo algo extremamente explicito  mas algu m como voc  que n o perdoa uma fala problem tica   muito estranho esse amor pela la s  mas enfim isso   algo pessoal seu  eu nem temho nada a ver  s  acho estranho mesmo 
51,1647832167000.0,2022-03-20 20:09:27,O Eli nem vai dormir essa noite. Vai morder a fronha de raiva q ñ ganha nada kkkkkk #BBB22,o eli nem vai dormir essa noite  vai morder a fronha de raiva q   ganha nada kkkkkk  bbb22
52,1647832167000.0,2022-03-20 20:09:27,Kkkkkkkk ele nem disfarça que quer que o dg ganhe,kkkkkkkk ele nem disfar a que quer que o dg ganhe
53,1647832167000.0,2022-03-20 20:09:27,Show foi tão bom que nem lembrei de tirar foto minha sozinha kkkkkkk,show foi t o bom que nem lembrei de tirar foto minha sozinha kkkkkkk
54,1647832166000.0,2022-03-20 20:09:26,"A galera nem reclamava que a prova demorava, e eles meteram essa",a galera nem reclamava que a prova demorava  e eles meteram essa
55,1647832166000.0,2022-03-20 20:09:26,"até pra esperar a prova eles se separam do restante da casa, mas não são um grupo nem são fechados nem orbitam em volta do cu um do outro",at  pra esperar a prova eles se separam do restante da casa  mas n o s o um grupo nem s o fechados nem orbitam em volta do cu um do outro
56,1647832166000.0,2022-03-20 20:09:26,"bah é SACANAGEM essa prova  eu ficaria maluco se eu tivesse fazendo, não basta tu perder a rodada sem nem tentar nada tu ainda pode errar o ARREMESSO   tncccccccccc",bah   sacanagem essa prova  eu ficaria maluco se eu tivesse fazendo  n o basta tu perder a rodada sem nem tentar nada tu ainda pode errar o arremesso   tncccccccccc
57,1647832166000.0,2022-03-20 20:09:26,Nem o Tadeu tá perdoando o Eli 🗣️🗣️🗣️ #BBB22  https://t.co/0ImMrUGnzj,nem o tadeu t  perdoando o eli         bbb22   
58,1647832165000.0,2022-03-20 20:09:25,meu celular em 4% e eu não tenho nem ideia de onde ta meu carregador 💀,meu celular em 4  e eu n o tenho nem ideia de onde ta meu carregador  
59,1647832165000.0,2022-03-20 20:09:25,Sem sorte não se chupa nem um picolé kkkk,sem sorte n o se chupa nem um picol  kkkk
60,1647832165000.0,2022-03-20 20:09:25,Nem a roleta vai com a cara do Eliezer kkkkkkkk,nem a roleta vai com a cara do eliezer kkkkkkkk
61,1647832165000.0,2022-03-20 20:09:25,nem acredito q rachei o celular i bem pertin da câmera 😭,nem acredito q rachei o celular i bem pertin da c mera  
62,1647832165000.0,2022-03-20 20:09:25,Não consigo nem dormir de tanta preocupação com essas chuvas 😭,n o consigo nem dormir de tanta preocupa  o com essas chuvas  
63,1647832165000.0,2022-03-20 20:09:25,"presta atenção grt kkkkkkk q viajem e essa d fazer cara d nojo qndo fala seu nome na rodinha, vc nem e comentado entre agente 🤣",presta aten  o grt kkkkkkk q viajem e essa d fazer cara d nojo qndo fala seu nome na rodinha  vc nem e comentado entre agente  
64,1647832164000.0,2022-03-20 20:09:24,o mais engracado eh q essa nem eh triste mas a nostalgia smp q eu escuto ela eh surreal...,o mais engracado eh q essa nem eh triste mas a nostalgia smp q eu escuto ela eh surreal   
65,1647832164000.0,2022-03-20 20:09:24,22 anos ? Nem acreditei,22 anos   nem acreditei
66,1647832164000.0,2022-03-20 20:09:24,"@baeknewl @filipeanjo O problema não é nem esse, é teu flerte ser: e-ei, você sabe qual a p-proxima evolução do s-squirtle?",    o problema n o   nem esse    teu flerte ser  e ei  voc  sabe qual a p proxima evolu  o do s squirtle 
67,1647832164000.0,2022-03-20 20:09:24,"tem certas coisas que eu vejo, que não sei nem como reagir",tem certas coisas que eu vejo  que n o sei nem como reagir
68,1647832164000.0,2022-03-20 20:09:24,@w3b_kaua Nem se falam mais k,  kaua nem se falam mais k
69,1647832164000.0,2022-03-20 20:09:24,Duas horas pro DG errar o negócio num numero que nem é o certo,duas horas pro dg errar o neg cio num numero que nem   o certo
70,1647832163000.0,2022-03-20 20:09:23,"@debscalcomania Isso é desculpa pra justificar a perseguição...a maioria nem sabe do q tá falando, tem gente nos quotes dizendo q nem olha o perfil..basta ver o emoji q tá tá Block...isso só confirma q nunca foi sobre proteger ninguém, eles só arrumaram uma desculpa pra destilar ódio por aí",  isso   desculpa pra justificar a persegui  o   a maioria nem sabe do q t  falando  tem gente nos quotes dizendo q nem olha o perfil  basta ver o emoji q t  t  block   isso s  confirma q nunca foi sobre proteger ningu m  eles s  arrumaram uma desculpa pra destilar  dio por a 
71,1647832163000.0,2022-03-20 20:09:23,não consigo nem expressar o tanto que sou apaixonada por ele 🥺,n o consigo nem expressar o tanto que sou apaixonada por ele  
72,1647832163000.0,2022-03-20 20:09:23,O DG teimando num número q nem tem coisa realmente sksks,o dg teimando num n mero q nem tem coisa realmente sksks
73,1647832162000.0,2022-03-20 20:09:22,Amando o DG indo no 18🥰🥰nem acerta e nem é o número certo,amando o dg indo no 18  nem acerta e nem   o n mero certo
74,1647832162000.0,2022-03-20 20:09:22,"Não tem sorte, não tem resistência e nem agilidade. Tá comprovado que o problema é você, Eli. #BBB22",n o tem sorte  n o tem resist ncia e nem agilidade  t  comprovado que o problema   voc   eli   bbb22
75,1647832162000.0,2022-03-20 20:09:22,"você estaria me ajudando pra caramba agora,mas você se mostrou quem é de verdade e hoje em dia nem quero ouvir falar de ti",voc  estaria me ajudando pra caramba agora mas voc  se mostrou quem   de verdade e hoje em dia nem quero ouvir falar de ti
76,1647832162000.0,2022-03-20 20:09:22,"teve tanto hype no início e agora eu nem vejo o pessoal comentar sobre ela, acho que quando lançar a segunda temporada nem vai ter tanto impacto assim como a primeira",teve tanto hype no in cio e agora eu nem vejo o pessoal comentar sobre ela  acho que quando lan ar a segunda temporada nem vai ter tanto impacto assim como a primeira
77,1647832162000.0,2022-03-20 20:09:22,nem fudendo,nem fudendo
78,1647832162000.0,2022-03-20 20:09:22,@nerdnintendista E ele foi tbm ... Jogo gostoso q a gente nem sente a hora passar...  https://t.co/GvSA5y3be1,  e ele foi tbm     jogo gostoso q a gente nem sente a hora passar      
79,1647832162000.0,2022-03-20 20:09:22,a sorte do eli tá q nem a minha ultimamente pqp KKKKKKKKKK,a sorte do eli t  q nem a minha ultimamente pqp kkkkkkkkkk
80,1647832161000.0,2022-03-20 20:09:21,Nem precisamos esperar os offs hahaha,nem precisamos esperar os offs hahaha
81,1647832161000.0,2022-03-20 20:09:21,@mayaracpd 🤣🤣🤣🤣🤣🤣 não saber nem o próprio signo é foda rs,         n o saber nem o pr prio signo   foda rs
82,1647832161000.0,2022-03-20 20:09:21,"Nem o gel pra dor e lesão muscular doido de banha de cobra da minha vó faz meu braço parar de doer, acho que vou ter q deixar ele parado e não esforçar mt até melhorar :(((",nem o gel pra dor e les o muscular doido de banha de cobra da minha v  faz meu bra o parar de doer  acho que vou ter q deixar ele parado e n o esfor ar mt at  melhorar     
83,1647832160000.0,2022-03-20 20:09:20,KAKA ele disse q não quer nem conversar comigo 🥴,kaka ele disse q n o quer nem conversar comigo  
84,1647832160000.0,2022-03-20 20:09:20,Pior q o Eli só tirar 0 é o DG insistir num número q nem tá premiado,pior q o eli s  tirar 0   o dg insistir num n mero q nem t  premiado
85,1647832160000.0,2022-03-20 20:09:20,Nossa o Eli nem é azarado né!,nossa o eli nem   azarado n  
86,1647832160000.0,2022-03-20 20:09:20,"mrm, essa nega tá  morrendo ou tá  dando ?? Barulho ducarai nem tomar  banho em paz eu posso, isso é pornô para os ouvidos",mrm  essa nega t   morrendo ou t   dando    barulho ducarai nem tomar  banho em paz eu posso  isso   porn  para os ouvidos
87,1647832160000.0,2022-03-20 20:09:20,"Nem tô torcendo pra ninguém ,qualquer um que for a Laís sai no paredão  #BBB22",nem t  torcendo pra ningu m  qualquer um que for a la s sai no pared o   bbb22
88,1647832160000.0,2022-03-20 20:09:20,da nem pra criticar o dg td mundo já insistiu no erro mais de 6x,da nem pra criticar o dg td mundo j  insistiu no erro mais de 6x
89,1647832160000.0,2022-03-20 20:09:20,@14jotape eoq joao pedro KKKKKKK eu estudo sim nem venha,  eoq joao pedro kkkkkkk eu estudo sim nem venha
90,1647832160000.0,2022-03-20 20:09:20,@bxbeatrizn como assim mais? você nem tem nenhum,  como assim mais  voc  nem tem nenhum
91,1647832160000.0,2022-03-20 20:09:20,@AllexMarx Espero que envelheça q nem leite esse tweet.,  espero que envelhe a q nem leite esse tweet 
92,1647832160000.0,2022-03-20 20:09:20,"@CrisVolta Moça eu estava lá, na Paulista, nesse dia. Tem tanto tempo que nem se exigia máscaras por decreto em SP. Quem deu o tiro  na perna dela foi um militar reformado (idoso) que foi tirado às pressas pela PM-SP, para protegê-lo. Mas não tem sentido você postar hoje fora do contexto.",  mo a eu estava l   na paulista  nesse dia  tem tanto tempo que nem se exigia m scaras por decreto em sp  quem deu o tiro  na perna dela foi um militar reformado  idoso  que foi tirado  s pressas pela pm sp  para proteg  lo  mas n o tem sentido voc  postar hoje fora do contexto 
93,1647832159000.0,2022-03-20 20:09:19,Cara nem arde 🤣,cara nem arde  
94,1647832159000.0,2022-03-20 20:09:19,"n é nem q a lais entrega entretenimento e mais q ela movimenta o jogo, 1% dele pelo menos coisa que o eliezer n faz",n   nem q a lais entrega entretenimento e mais q ela movimenta o jogo  1  dele pelo menos coisa que o eliezer n faz
95,1647832158000.0,2022-03-20 20:09:18,@Glendadeboa nem parece q tá me xingando,  nem parece q t  me xingando
96,1647832158000.0,2022-03-20 20:09:18,"@naosabiapoliana nem parece,esperamos tanto",  nem parece esperamos tanto
97,1647832158000.0,2022-03-20 20:09:18,o celular passou o dia INTEIRO carregando e essa porra não carregou nem 2% se fude também buceta do caralho,o celular passou o dia inteiro carregando e essa porra n o carregou nem 2  se fude tamb m buceta do caralho
98,1647832158000.0,2022-03-20 20:09:18,E nem é meme,e nem   meme
99,1647832158000.0,2022-03-20 20:09:18,"Não poderia me importar menos com esse paredão, tanto que nem sei quem está nele",n o poderia me importar menos com esse pared o  tanto que nem sei quem est  nele
